{
  "$schema": "https://json-schema.org/draft/2020-12/schema",
  "title": "Octoplanner Requirement",
  "type": "object",
  "additionalProperties": false,
  "required": ["id", "itemId", "quantity"],
  "properties": {
    "id": { "type": "string", "minLength": 1 },
    "itemId": { "type": "string", "minLength": 1 },
    "quantity": { "type": "number", "exclusiveMinimum": 0 },
    "dueAt": { "type": "string", "format": "date-time" },
    "priority": { "type": "number" },
    "customer": { "type": "string", "minLength": 1 },
    "vehicleModel": { "type": "string", "minLength": 1 },
    "attributes": {
      "type": "object",
      "additionalProperties": { "type": "string" }
    },
    "externalRef": { "$ref": "#/$defs/externalRef" }
  },
  "$defs": {
    "externalRef": {
      "type": "object",
      "additionalProperties": false,
      "required": ["system", "id"],
      "properties": {
        "system": { "type": "string", "minLength": 1 },
        "id": { "type": "string", "minLength": 1 },
        "payload": {}
      }
    }
  }
}
